{"at":"2026-10-07T03:01:00Z","by":"po@example.test","data_sha256":"5a9fc20b4f951adb81c0d0fb0a1814be6c6ff81dc8f2a46ba932e5e2de985620","default":"approve","exceptions":[],"id":"fixture-decision","overrides":[],"packet_id":"packet-5a9fc20b4f951adb81c0d0fb0a1814be6c6ff81dc8f2a46ba932e5e2de985620","pins":{"base":"e7671c1efc6a124d33104ca84c210242d90e447d841ef5bc6203bafba2bff47c","build":"not-built","head":"1e69356026ce19097694130deb4214bc1dc67f568d2322ea4b945ec2b64abd5b","manifest":"52c669c078d4cb4db756c155c19368843b859bbbc1e78a94da5d1399cecc67db"},"reason":"Illustrative contract fixture only","scope":{"ids":["US-16.AC-01"],"kind":"ac","revision":"a84645d61daea3988dcb2a2c65a3ccedd8f1a94073e020dbc020b37e28dd2f03"}}